{
  "schema_version": "0.1.0",
  "trace_id": "3f2b8c1e-6d4a-4c1e-9b7a-1a2b3c4d5e01",
  "odoo_version": "19.0",
  "dry_run": true,
  "started_at": "2026-10-03T12:00:00+00:00",
  "entrypoint": {
    "model": "sale.order",
    "method": "action_confirm",
    "record_ids": [
      1
    ],
    "context": {}
  },
  "steps": [
    {
      "id": "s1",
      "parent_id": null,
      "seq": 1,
      "kind": "method_call",
      "model": "sale.order",
      "method": "action_confirm",
      "module": "sale",
      "mro_position": 0,
      "calls_super": false,
      "record_ids": [
        1
      ],
      "args_summary": null,
      "return_summary": "True",
      "changes": [],
      "duration_ms": 18.4,
      "error": null
    },
    {
      "id": "s2",
      "parent_id": "s1",
      "seq": 2,
      "kind": "method_call",
      "model": "sale.order",
      "method": "_confirmation_error_message",
      "module": "sale",
      "mro_position": 0,
      "calls_super": false,
      "record_ids": [
        1
      ],
      "args_summary": null,
      "return_summary": "False",
      "changes": [],
      "duration_ms": 0.3,
      "error": null
    },
    {
      "id": "s3",
      "parent_id": "s1",
      "seq": 3,
      "kind": "orm_write",
      "model": "sale.order",
      "method": "write",
      "module": null,
      "mro_position": null,
      "calls_super": null,
      "record_ids": [
        1
      ],
      "args_summary": "{'state': 'sale', 'date_order': '2026-10-03 12:00:00'}",
      "return_summary": "True",
      "changes": [
        {
          "model": "sale.order",
          "record_id": 1,
          "field": "state",
          "old": "draft",
          "new": "sale"
        },
        {
          "model": "sale.order",
          "record_id": 1,
          "field": "date_order",
          "old": "2026-10-01 09:00:00",
          "new": "2026-10-03 12:00:00"
        }
      ],
      "duration_ms": 6.1,
      "error": null
    },
    {
      "id": "s4",
      "parent_id": "s1",
      "seq": 4,
      "kind": "method_call",
      "model": "sale.order",
      "method": "_action_confirm",
      "module": "sale",
      "mro_position": 0,
      "calls_super": false,
      "record_ids": [
        1
      ],
      "args_summary": null,
      "return_summary": null,
      "changes": [],
      "duration_ms": 0.2,
      "error": null
    }
  ],
  "error": null
}
